,id,created_at,retweet_count,text
0,1035060980286251008,2018-08-30 07:05:42,1,"@iiit_hyderabad turns 20! The countdown begins to a weekend of celebrating the institute, its research and innovations. See you there! #iiith, #iiithyderabad #iiithturnstwenty #showcase https://t.co/2asHoMRZoz"
12,1030022347397324800,2018-08-16 09:23:59,4,"Sheikh Zakir Hussain, MS by Research student from the Signal Processing and Communications Research Centre (SPCRC) shares his latest research on tackling mobile network issues. https://t.co/6OGb3POu5n
#iiith #iiithyderabad #spcrc #5G https://t.co/L97tRUaX0a"
27,1025307202402144256,2018-08-03 09:07:40,7,"A digital tour guide of a heritage structure? So what’s new, you may ask. IIIT-H students from the CVIT research centre have come out with a unique approach that lets you customize the tour with a story-telling experience that maps your interests. Read on. https://t.co/GrQXehrxum https://t.co/6V23P2GttS"
36,1019498671207903232,2018-07-18 08:26:39,3,"This senior research fellow from the Lab of Spatial Informatics at IIITH has been winning accolades and creating waves at every international conference and workshop she’s attended this year. Meet 26-year-old Salghuna Nair from Trichy, Tamil Nadu. https://t.co/1xnWFLRYNN https://t.co/YRfp7rCdWh"
37,1018734548677320705,2018-07-16 05:50:18,5,"Prof @aniketalam from Centre of Exact Humanities, IIIT-Hyderabad is researching the continuity and change in Spiti Valley over the past millennia. Read on to find out how he's going about it.
https://t.co/w0KlAPI64l https://t.co/CJ5tvhgXXz"
44,1014385238783373313,2018-07-04 05:47:41,6,"With its emphasis on applied research, IIIT-H's Structured Software Analysis and Design (SSAD) course encourages undergrads to work with startups and SMEs. If you're a startup looking to build a prototype, read on.https://t.co/jMEFRfWlFM #SSAD #iiith #serc https://t.co/QdRIlv603v"
52,1000993496864407552,2018-05-28 06:53:41,7,"In honour of their son, Vedant Kidambi (special MS by Research student, 2008-2010), Girija and Uday Kumar have created an endowment fund supported by a generous donation of 20 lakhs towards research in the field of Cognitive Science at @iiit_hyderabad .https://t.co/lAdwhdXphj https://t.co/nr3gw2dHGe"
63,989024302925320192,2018-04-25 06:12:23,1,"From building algorithms that model Hindi-English speech to rock climbing, Fulbright-Nehru scholar Kelsey Taylor Ball shares her experience of completing her research project and enjoying India’s kaleidoscopic diversity during her tenure at IIIT-H. https://t.co/jgwxPHlDfs https://t.co/8kG6vkgbr9"
68,987278879311081475,2018-04-20 10:36:42,8,"A delegation of students from IIIT-H led by @devvarma attended @ecir2018 in Grenoble, France. We take you through a brief summary of their research work presented at this premier forum. https://t.co/SllYrJDqUF https://t.co/xWTmlNLkdG"
71,986174461882716160,2018-04-17 09:28:08,0,"With the world being driven by intellectual property and deeptech, there’s an immediate need to take research from lab to land @rameshl1 discusses real-world problems faced by industry and universities, and how IIIT-Hyderabad is attempting to overcome them https://t.co/vWr40XWFCX https://t.co/DWjqrNKgdn"
79,981774543487303685,2018-04-05 06:04:26,8,IIITH alumnus @venkypotluri will soon take his pick from his choice of top graduate schools across the US to further his research interests. We catch up with him and find out what it takes to be a visionary. https://t.co/LSsK8yrBys https://t.co/k5QFN2ymBr
83,977079781597597696,2018-03-23 07:09:07,1,"Furthering his interest in rational problem-solving, #iiithyderabad #dualdegree student Tarun Gupta's research on Planning and Learning for Decentralized Markov Decision Processes with Event-Driven Rewards gets recognised at #AAAI18  https://t.co/fc4kTA0Lj6"
99,968396477629378560,2018-02-27 08:04:46,4,"If you’re a 2nd year engineering student looking to change colleges, and have a strong desire to work on research problems, consider IIIT-Hyderabad’s Lateral Entree Admissions. Application deadline 15 March 2018. #iiithyderabad #lateralentry #dualdegree #CSD #ECD https://t.co/Vwp6xkc7qh"
117,956395551234248704,2018-01-25 05:17:23,2,"RT @devvarma: Explainability is back as research focus where the automated AI systems need to explain the decisions made by them

  @ericho…"
121,956114010381807616,2018-01-24 10:38:38,4,"RT @devvarma: Apt keynote from prof Raj Reddy on AI in the service of humanity at the @Indiaacm @MicrosoftIndia  academic research summit""A…"
129,948469090011684866,2018-01-03 08:20:27,1,"@nimmir's research paper on Scaling Classroom IT Skill Tutoring - A Case Study from India has been chosen to be presented at @sigchi 2018 in Montreal, Canada. Noted journalist @Kurmanath, Deputy Editor, The Hindu Business Line reports: https://t.co/FtnhYJnZDA"
130,945565914098835456,2017-12-26 08:04:16,3,"IIIT-Hyderabad, Honeywell Techteam up for research | Business Line https://t.co/CjHfxwHxa6"
136,928503876633763841,2017-11-09 06:05:49,3,"Open House on @iiit_hyderabad's various research centres and academic programs, with a special focus on ongoing PhD ECE CSE admissions on Monday 13th Nov 5:30pm. Everyones invited. Register now https://t.co/43pCfis670 https://t.co/qDx68uq5Yu"
199,869219118657830912,2017-05-29 15:49:21,1,Dr. Shreyas Saxena gave a talk on Convolutional Neural Fabrics on 23rd May. Dr. Saxena is is soon to join as a researcher at Apple AI. #AI
216,858301860460888065,2017-04-29 12:48:04,3,RT @TheOfficialACM: @iiit_hyderabad researchers are working on an AI system to detect the presence of hate speech in tweets. https://t.co/B…
311,809026168548655104,2016-12-14 13:24:04,9,"RT @devvarma: These are the kind of things our dual degree students of @iiit_hyderabad do, for their research :)

https://t.co/8excMepNRT"
321,801997087705436160,2016-11-25 03:53:00,1,Applications for Ph.D program in the winter research cycle close today. Apply at https://t.co/jL7EYyuWzf https://t.co/qKd7BPefA7
341,794399863094018048,2016-11-04 04:44:21,0,"IIIT Hyderabad was a host to Dr Kalpana Kannabiran, a well known researcher in women and gender studies, she (cont) https://t.co/ckcZF0UFj4"
361,788682856721547264,2016-10-19 10:07:00,1,"A smart virtual tour guide by researchers at CVIT, IIIT Hyderabad! https://t.co/f532g0i8Ft"
383,781783236896751616,2016-09-30 09:10:23,0,"The Earthquake Engineering Research Centre (EERC), a research centre of IIIT Hyderabad organized a 5-day (cont) https://t.co/Di7kmYkhor"
439,764034667028754433,2016-08-12 09:43:54,1,RT @rameshl1: We welcome you to the series of information posters on the research departments of IIIT Hyderabad. Stay tuned for... https://…
509,712878547279482880,2016-03-24 05:47:44,1,RT @devvarma: India-based IoT startup Cube26 ties up with IIIT-Hyderabad to strengthen research on cognitive intelligence https://t.co/SGnt…
519,710509576160804866,2016-03-17 16:54:18,0,"IIIT-H student, Pushyami Rachapudi mentioned in MIT News! Pushyami was a visiting researcher at @medialab. Read :https://t.co/AhhcXJ1FSz"
